{
    "survey_id": "sample_survey",
    "language": "EN",
    "results": [
        {
            "result_id": "score1",
            "result_name": "Scalar Score",
            "result_text": "This score represents a scalar",
            "result": {
                "type": "scalar",
                "value": 10,
                "unit": "m",
                "value_lower_bound": 0,
                "value_upper_bound": 1000,
                "is_reverse_order": false,
                "use_dial": false
            }
        },
        {
            "result_id": "score2",
            "result_name": "Likelihood Score",
            "result_text": "This score represents a percentage value",
            "result": {
                "type": "percentage",
                "value": 10,
                "result_explanation": "You have a high likelihood of xxx",
                "is_reverse_order": true,
                "use_dial": true
            }
        },
        {
            "result_id": "score3",
            "result_name": "Text Output",
            "result_text": "This output represents a text description",
            "result": {
                "type": "text",
                "value": "blah blah blah"
            }
        }
    ],
    "use_multiedged_graph": false,
    "use_table": true,
    "final_message": "This survey result is unofficial and does not represent medical advice. Please seek professional for an official diagnosis."
}