{
    "survey_id": "dass",
    "language": "EN",
    "results": [
        {
            "result_id": "anxiety_likelihood",
            "result_name": "Likelihood of Moderate Anxiety",
            "result_text": "This score represents a percentage value of the likelihood of moderate anxiety",
            "result": {
                "type": "percentage",
                "value": 10,
                "result_explanation": "Your likelihood of moderate anxiety is xxx",
                "is_reverse_order": true,
                "use_dial": true
            }
        },
        {
            "result_id": "depression_likelihood",
            "result_name": "Likelihood of Moderate Depression",
            "result_text": "This score represents a percentage value of the likelihood of moderate depression",
            "result": {
                "type": "percentage",
                "value": 10,
                "result_explanation": "Your likelihood of moderate depression is xxx",
                "is_reverse_order": true,
                "use_dial": true
            }
        },
        {
            "result_id": "stress_likelihood",
            "result_name": "Likelihood of Moderate Stress",
            "result_text": "This score represents a percentage value of the likelihood of moderate stress",
            "result": {
                "type": "percentage",
                "value": 10,
                "result_explanation": "Your likelihood of moderate stress is xxx",
                "is_reverse_order": true,
                "use_dial": true
            }
        }
    ],
    "use_multiedged_graph": true,
    "use_table": false,
    "final_message": "Displayed is your estimated likelihood of moderate anxiety, depression or stress given your answers to the DASS questions. This is calculated through a machine learning model trained using data collected from an online survey.\n\n*This webpage does not contain medical/health advice. This tool is intended for informational and educational purposes only, and should not be taken as a substitute for professional advice. Reliance on any information on the webpage is solely at your own risk."
}
