{
    "survey_id": "mmpi",
    "language": "EN",
    "results": [
        {
            "result_id": "hypochondriasis",
            "result_name": "Likelihood of Hypochondriasis (Hs)",
            "result_text": "This score represents the likelihood of Hypochondriasis as measured by MMPI-100",
            "result": {
                "type": "percentage",
                "value": 10,
                "result_explanation": "You have a high likelihood of Hypochondriasis",
                "is_reverse_order": false,
                "use_dial": true
            }
        },
        {
            "result_id": "depression",
            "result_name": "Likelihood of Depression (D)",
            "result_text": "This score represents the likelihood of Depression as measured by MMPI-100",
            "result": {
                "type": "percentage",
                "value": 10,
                "result_explanation": "You have a high likelihood of Depression",
                "is_reverse_order": false,
                "use_dial": true
            }
        },
        {
            "result_id": "hysteria",
            "result_name": "Likelihood of Hysteria (Hy)",
            "result_text": "This score represents the likelihood of Hysteria as measured by MMPI-100",
            "result": {
                "type": "percentage",
                "value": 10,
                "result_explanation": "You have a high likelihood of Hysteria",
                "is_reverse_order": false,
                "use_dial": true
            }
        },
        {
            "result_id": "psychopathic_deviate",
            "result_name": "Likelihood of Psychopathic Deviate (Pd)",
            "result_text": "This score represents the likelihood of Psychopathic Deviate as measured by MMPI-100",
            "result": {
                "type": "percentage",
                "value": 10,
                "result_explanation": "You have a high likelihood of Psychopathic Deviation",
                "is_reverse_order": false,
                "use_dial": true
            }
        },
        {
            "result_id": "masculinity_femininity",
            "result_name": "Likelihood of Masculinity (MF)",
            "result_text": "This score represents the likelihood of being masculine as measured by MMPI-100",
            "result": {
                "type": "percentage",
                "value": 10,
                "result_explanation": "You have a high likelihood of Masculinity",
                "is_reverse_order": false,
                "use_dial": true
            }
        },
        {
            "result_id": "paranoia",
            "result_name": "Likelihood of Paranoia (Pa)",
            "result_text": "This score represents the likelihood of Paranoia as measured by MMPI-100",
            "result": {
                "type": "percentage",
                "value": 10,
                "result_explanation": "You have a high likelihood of Paranoia",
                "is_reverse_order": false,
                "use_dial": true
            }
        },
        {
            "result_id": "psychasthenia",
            "result_name": "Likelihood of Psychasthenia (Pt)",
            "result_text": "This score represents the likelihood of Psychasthenia as measured by MMPI-100",
            "result": {
                "type": "percentage",
                "value": 10,
                "result_explanation": "You have a high likelihood of Psychasthenia",
                "is_reverse_order": false,
                "use_dial": true
            }
        },
        {
            "result_id": "schizophrenia",
            "result_name": "Likelihood of Schizophrenia (Sc)",
            "result_text": "This score represents the likelihood of Schizophrenia as measured by MMPI-100",
            "result": {
                "type": "percentage",
                "value": 10,
                "result_explanation": "You have a high likelihood of Schizophrenia",
                "is_reverse_order": false,
                "use_dial": true
            }
        },
        {
            "result_id": "hypomania",
            "result_name": "Likelihood of Hypomania (Ma)",
            "result_text": "This score represents the likelihood of Hypomania as measured by MMPI-100",
            "result": {
                "type": "percentage",
                "value": 10,
                "result_explanation": "You have a high likelihood of Hypomania",
                "is_reverse_order": false,
                "use_dial": true
            }
        },
        {
            "result_id": "introversion",
            "result_name": "Likelihood of Social Introversion (Si)",
            "result_text": "This score represents the likelihood of Social Introversion as measured by MMPI-100",
            "result": {
                "type": "percentage",
                "value": 10,
                "result_explanation": "You have a high likelihood of Social Introversion",
                "is_reverse_order": false,
                "use_dial": true
            }
        }
    ],
    "use_multiedged_graph": true,
    "use_table": false,
    "final_message": "Displayed are the predicted likelihoods for the 10 measurements of MMPI. This is calculated through a machine learning model trained using patient data.\n\n*This webpage does not contain medical/health advice. This tool is intended for informational and educational purposes only, and should not be taken as a substitute for professional advice. Reliance on any information on the webpage is solely at your own risk."
}
