{
    "survey_id": "nafld",
    "language": "EN",
    "results": [
        {
            "result_id": "nafld_likelihood",
            "result_name": "Likelihood of NAFLD",
            "result_text": "This score represents a percentage value of the likelihood of having NAFLD",
            "result": {
                "type": "percentage",
                "value": 10,
                "result_explanation": "You have a high likelihood of xxx",
                "is_reverse_order": true,
                "use_dial": true
            }
        }
    ],
    "use_multiedged_graph": true,
    "use_table": false,
    "final_message": "Displayed is your estimated likelihood of Non-Alcoholic Fatty Liver Disease (NAFLD) given your physical measurements and blood biomarkers. This is calculated through a machine learning model trained using patient data.\n\n*This webpage does not contain medical/health advice. This tool is intended for informational and educational purposes only, and should not be taken as a substitute for professional advice. Reliance on any information on the webpage is solely at your own risk."
}
